{
  "schemaVersion": 1,
  "sourceItemKey": "synthetic:source:1",
  "sourceKind": "image",
  "sourceUrl": "https://example.invalid/source.jpg",
  "sourcePageUrl": null,
  "sourceTitle": "Synthetic source",
  "sourceSnapshotSha256": "aaaaaaaaaaaaaaaaaaaaaaaaaaaaaaaaaaaaaaaaaaaaaaaaaaaaaaaaaaaaaaaa",
  "historicalDisposition": "migrate",
  "normalizedDisposition": "migrated",
  "targetOwnerKind": "activity",
  "targetOwnerMigrationKey": "synthetic:activity:1",
  "targetStatus": "draft",
  "reviewStatus": "requires-owner-review",
  "privacyStatus": "private-draft",
  "evidenceFiles": ["tests/phase13/fixtures/valid/source-item.valid.json"],
  "notes": ["Synthetic fixture only."]
}
